"tema","autor_anio","titulo","venue","doi_isbn","hallazgo_clave","relevancia_gap_miu"
"caos determinista","Lorenz (1963)","Deterministic Nonperiodic Flow","Journal of the Atmospheric Sciences 20(2):130-141","10.1175/1520-0469(1963)020<0130:DNF>2.0.CO;2","Descubre el atractor extrano y la sensibilidad a condiciones iniciales (efecto mariposa) en un sistema de solo 3 ecuaciones","Fundamento de por que sistemas deterministas pueden parecer aleatorios; relevante para D_f en series caoticas"
"caos determinista","Grassberger and Procaccia (1983)","Measuring the strangeness of strange attractors","Physica D 9(1-2):189-208","10.1016/0167-2789(83)90298-1","Introduce la dimension de correlacion, metodo practico para estimar dimension fractal de atractores desde datos","Metodo alternativo directo a box-counting/DFA para estimar D_f en series temporales reales"
"caos determinista","Takens (1981)","Detecting strange attractors in turbulence","Lecture Notes in Mathematics 898:366-381","10.1007/BFb0091924","Teorema de reconstruccion de espacio de fases: se puede reconstruir la dinamica completa de un sistema desde una sola variable observada con retardos","Base matematica necesaria antes de aplicar Grassberger-Procaccia a series MIU univariadas"
"sistemas dinamicos","Strogatz (1994)","Nonlinear Dynamics and Chaos","Westview Press (libro)","ISBN 978-0738204536","Texto de referencia estandar: bifurcaciones, atractores, exponentes de Lyapunov, caos en sistemas biologicos y sociales","Manual practico para implementar cualquier estimador D_f/caos mencionado en el corpus"
"exponentes de Lyapunov","Wolf, Swift, Swinney and Vastano (1985)","Determining Lyapunov exponents from a time series","Physica D 16(3):285-317","10.1016/0167-2789(85)90011-9","Algoritmo practico y ampliamente citado para calcular exponentes de Lyapunov directamente de datos experimentales","Metrica complementaria a D_f: mide tasa de divergencia, no solo geometria del atractor"
"transiciones de fase / criticalidad","Sornette (2006)","Critical Phenomena in Natural Sciences","Springer (libro)","ISBN 978-3540308829","Sintesis extensa de como power-laws y criticalidad emergen en terremotos, mercados, y rupturas de materiales","Puente directo entre power-law/D_f y prediccion de eventos extremos, relevante para HUESOs sobre colapso"
"prediccion de eventos extremos","Sornette and Ouillon (2012)","Dragon-kings: mechanisms, statistical methods and empirical evidence","European Physical Journal Special Topics 205:1-26","10.1140/epjst/e2012-01559-5","Propone que ciertos eventos extremos no siguen la cola de la power-law general sino que son cualitativamente distintos (dragon-kings)","Matiz critico: no todo evento extremo en el corpus MIU debe forzarse a una power-law unica"